{
  "application_language": "en",
  "city": "México",
  "company": "Golabs Tech",
  "company_category": "Otro",
  "content_hash": "05f1d4b815784136f344fdfa39384d259975416089083a1615a67c6ab52fc5b2",
  "description": null,
  "fit_gaps": [
    "Es un proyecto contractual inicial de tres meses, aunque existe posibilidad de extensión, lo que reduce estabilidad frente a una contratación permanente.",
    "Golabs es una empresa de servicios tecnológicos y no una compañía de producto prioritaria.",
    "El dominio requerido se concentra en CPG, ventas, finanzas o supply chain y no en banca, fraude o credit scoring.",
    "PySpark y SQL no aparecen como requisitos explícitos en la publicación recuperada."
  ],
  "fit_score": 92.0,
  "fit_strengths": [
    "Posición 100% remota para México con compensación en USD.",
    "Rol hands-on orientado a diseñar, desarrollar, desplegar y mejorar continuamente soluciones de Data Science e IA productivas.",
    "Exige Python y experiencia reciente con Generative AI, LLMs y agentic workflows, incluyendo agentes desplegados en producción.",
    "Incluye optimización matemática mediante programación lineal, mixed-integer programming y heurísticas, ampliando el rango de problemas de decisión abordados.",
    "El alcance exige traducir problemas de negocio en soluciones analíticas escalables y colaborar con equipos multifuncionales."
  ],
  "fit_summary": "Buen match por modalidad 100% remota, Python, GenAI, agentes en producción y ownership de soluciones end-to-end. Se incluye como segunda opción por su fuerte ajuste técnico, aunque el contrato corto y el modelo de servicios reducen considerablemente su prioridad.",
  "identity_key": "4085811308aea748ba4ad95d6b2dd5dcd2be05955ad1059a94a4885faa1fdc40",
  "jd_fidelity": "sparse",
  "jd_fidelity_reasons": [
    "description_chars=0",
    "substantive_requirements=0",
    "substantive_responsibilities=0",
    "insufficient original JD detail; source-fit commentary and inferred tech stack do not count toward fidelity"
  ],
  "jd_fidelity_score": 0.0,
  "jd_generation_eligible": false,
  "language_confidence": 0.86,
  "language_source": "role_title",
  "location_raw": "México",
  "posted_date": null,
  "posted_date_raw": "Hace 2 días",
  "provenance": [
    {
      "source_commit": "f3c002ab46021434d327bdeb07a45da6dc2ff249",
      "source_entry_index": 1,
      "source_format": "vacantes_v1",
      "source_hash": "19ec24081d55501bfa01dcdeeeced8dbfefa4996561602672235213b36616d86",
      "source_native_id": "golabs-4454096526",
      "source_path": "Vacantes/vacantes_2026-09-01.json",
      "source_search_date": "2026-09-01",
      "source_updated_at": null
    }
  ],
  "requirements": [],
  "responsibilities": [],
  "role_title": "Senior Data Scientist",
  "salary": "Competitivo en USD; monto no especificado",
  "schema_version": 2,
  "seniority": null,
  "tech_stack": [
    "Python",
    "Machine Learning",
    "Generative AI",
    "LLMs",
    "Agentic AI",
    "AI Agents",
    "Optimization",
    "Linear Programming",
    "Mixed-Integer Programming",
    "Heuristics",
    "Production AI"
  ],
  "url": "https://mx.linkedin.com/jobs/view/senior-data-scientist-at-golabs-tech-4454096526",
  "vacancy_id": "vac-4085811308aea748",
  "work_model": "Remote"
}
