{
  "application_language": "und",
  "city": "Corporativo Santa Fe, Ciudad de México, México",
  "company": "Santander México",
  "company_category": "Banca",
  "content_hash": "ddf3ebb8db37a7409ec325b1846cff34fee0f49fb6aeae87dd19d6c43798041c",
  "description": null,
  "fit_gaps": [
    "El requisito mínimo de experiencia es 4 años, bastante menor al seniority de 9+ años del perfil, por lo que conviene validar nivel, banda y alcance real.",
    "PySpark y GenAI no aparecen como requisitos explícitos.",
    "El título es de Gerencia de Estrategias de Decisión y no Data Scientist, aunque las responsabilidades son altamente compatibles con Decision Science y Credit Risk."
  ],
  "fit_score": 98.0,
  "fit_strengths": [
    "Alineación directa con riesgo de crédito: diseña y optimiza estrategias de decisión para originación y administración del portafolio de Crédito Automotriz.",
    "Aplica Inteligencia Artificial, Machine Learning y analítica avanzada a admisión, cobranza, clientes preaprobados, parámetros de riesgo, propensión y comportamiento.",
    "Incluye liderazgo sobre modelos de Credit Scoring y Risk-Based Pricing, además de monitoreo de portafolio y definición de políticas de crédito.",
    "Requiere SQL, Python, SAS, técnicas de Machine Learning y bases de datos.",
    "La formación objetivo incluye Actuaría y el puesto está contratado directamente por Santander con esquema permanente."
  ],
  "fit_summary": "Match excepcional para combinar experiencia bancaria, credit scoring, riesgo, ML, Python/SQL y liderazgo. Es especialmente atractiva por el dominio de decisión crediticia y la ubicación en Santa Fe con modalidad híbrida reportada.",
  "identity_key": "1816ac379c3f1f5c6f136874da4e09bf908e04048dacbc1142fc9c03280170a9",
  "jd_fidelity": "sparse",
  "jd_fidelity_reasons": [
    "description_chars=0",
    "substantive_requirements=0",
    "substantive_responsibilities=0",
    "insufficient original JD detail; source-fit commentary and inferred tech stack do not count toward fidelity"
  ],
  "jd_fidelity_score": 0.0,
  "jd_generation_eligible": false,
  "language_confidence": 0.0,
  "language_source": "undetermined",
  "location_raw": "Corporativo Santa Fe, Ciudad de México, México",
  "posted_date": null,
  "posted_date_raw": "Hace 6 días",
  "provenance": [
    {
      "source_commit": "40842a592a9de0fb18e3c6a0b42ae5af00895791",
      "source_entry_index": 1,
      "source_format": "vacantes_v1",
      "source_hash": "67b8c176ee334c388a6f788fd42307fa1b11519ba0c25d329ec21651006665ec",
      "source_native_id": "santander-Req1610092",
      "source_path": "Vacantes/vacantes_2026-09-07.json",
      "source_search_date": "2026-09-07",
      "source_updated_at": null
    }
  ],
  "requirements": [],
  "responsibilities": [],
  "role_title": "Gte Estrateg Decisi Credit Aut",
  "salary": "MXN 900,000 - 1,200,000 anuales (estimación publicada por fuente secundaria; no confirmado por Santander)",
  "schema_version": 2,
  "seniority": null,
  "tech_stack": [
    "Python",
    "SQL",
    "SAS",
    "Machine Learning",
    "Artificial Intelligence",
    "Credit Scoring",
    "Risk-Based Pricing",
    "Credit Risk",
    "Portfolio Analytics",
    "Power BI",
    "Decision Strategies"
  ],
  "url": "https://santander.wd3.myworkdayjobs.com/it-IT/SantanderCareers/job/Gte-Estrateg-Decisi-Credit-Aut_Req1610092",
  "vacancy_id": "vac-1816ac379c3f1f5c",
  "work_model": "Hybrid"
}
