{
  "application_language": "en",
  "city": "Ciudad de México, México",
  "company": "Etsy",
  "company_category": "E-commerce",
  "content_hash": "2e61204136743a49b8db169abe724e2a147dec29c2483040ad1a9a7307ff8b26",
  "description": "Company Description Etsy is the global marketplace for unique and creative goods. We build, power, and evolve the tools and technologies that connect millions of entrepreneurs with millions of buyers around the world. As an Etsy Inc. employee , whether a team member of Etsy or Depop, you will tackle unique, meaningful, and large-scale problems alongside passionate coworkers, all the while making a rewarding impact and Keeping Commerce Human. What's the role? As a Senior Data Scientist in Seller Analytics you will be building out and discovering insights for the heart of Etsy - our sellers. This scientist will be essential in helping us create best-in-class seller tools, monitoring and improving performance and adoption of these tools, and working to ensure new sellers onboarding to Etsy have a smooth process. As a senior data scientist, you will be a key partner in shaping the future of the Etsy seller service roadmap. This position acts as a leader and collaborator with product, design, engineering, and research to drive insights. We are looking for someone who understands how to weigh opportunities, create unique insights, and is passionate about thinking and communicating around the seller experience. Would you enjoy supporting a rapidly growing vector at Etsy and have an impact at the highest level? If so, this could be the perfect match. This is a full-time position reporting to the Senior Manager of Seller Analytics In addition to salary, you will also be eligible for an equity package, an annual performance bonus, and our competitive benefits that support you and your family as part of your total rewards package at Etsy. This role requires your presence in Etsy’s Mexico City Office once or twice per week depending on your proximity to the office. Candidates living within commutable distance of Etsy’s Mexico City Office Hub may be the first to be considered. Learn more details about our work modes and workplace safety policies here . What’s this team like at Etsy? Seller Analytics is an analytics team committed to applying the techniques of data science and analytics to drive significant insights, including: Leading improvements to the seller experience using data driven insights Understanding the nuances of Etsy’s sellers how they interplay with Etsy’s right to win Building rich data sources of truth that interweave sophisticated seller data and foundational data from across the Etsy ecosystem Finding and advocating for outstanding opportunities for Etsy’s growth that move critical metrics We are a remote friendly team - all of our collaboration is inclusive of folks in an office and on the screen What does the day-to-day look like? Develop insights from trends and research in our seller data. Work with our seller product teams to ensure launches are impactful and the seller experience is being improved. Build foundational scripts using SQL and database skills. Craft outstanding dashboards and visualizations using Looker. Participate in dialogues with external vendors and collaborators, including technical developers. Connect with partners on timelines, priorities, and expectations for proposals. Continually evaluate and refine your technical toolkit; share what you learn with the team. Possess a deep level of curiosity and appetite for learning, which drives you to finding outstanding solutions. Of course, this is just a sample of the kinds of work this role will require! You should assume that your role will encompass other tasks, too, and that your job duties and responsibilities may change from time to time at Etsy's discretion, or otherwise applicable with local law. Qualities that will help you thrive in this role are: 4+ years experience supporting seller side e-commerce, or product/engineering teams as an analyst or in a quantitative role in which you extracted meaning from sophisticated data sets. Have an understanding of two-sided marketplaces and e-commerce processes. A proficiency in SQL and some experience with Python or R. Fluent in English with the ability to communicate your insights verbally, visually and in writing. A deep care about the quality of your data and the integrity of your work. A passion for reproducible work and tools to this end; you can mentor others how to make their own work better and more efficient. A curious nature about subjects such as quantitative analysis, data visualization, and process efficiency. Validated project management skills and capability in carrying projects through to completion. A trust in and dedication to Etsy’s vision, mission and values. Additional Information What's Next If you're interested in joining the team at Etsy, please share your resume with us and feel free to include a cover letter if you'd like. As we hope you've seen already, Etsy is a place that values individuality and variety. We don't want you to be like everyone else -- we want you to be like you! So tell us what you're all about. Our Promise At Etsy, we believe that a diverse, equitable and inclusive workplace furthers relevance, resilience, and longevity. We encourage people from all backgrounds, ages, abilities, and experiences to apply. Etsy is proud to be an equal opportunity workplace. We are committed to equal employment opportunity regardless of race, color, ancestry, religion, sex, national origin, sexual orientation, age, citizenship, marital status, disability, gender identity or veteran status, or any other characteristic protected by applicable law. If, due to a disability, you need an accommodation during any part of the application or interview process, please let your recruiter know. While Etsy supports visa sponsorship, sponsorship opportunities may be limited to certain roles and skills.",
  "fit_gaps": [
    "La vacante está más orientada a Product Analytics y Seller Analytics que a modelado avanzado end-to-end o MLOps.",
    "PySpark, GenAI, fraude, riesgo y credit scoring no aparecen como requisitos explícitos.",
    "El mínimo publicado es 4+ años, por debajo del seniority del perfil objetivo, aunque el alcance incluye liderazgo y colaboración de nivel senior."
  ],
  "fit_score": 94.0,
  "fit_strengths": [
    "Rol Senior Data Scientist en una empresa global de producto y marketplace, con impacto directo sobre roadmap, experiencia de sellers y métricas de negocio.",
    "Modalidad híbrida favorable en Ciudad de México, con presencia requerida solo una o dos veces por semana según proximidad a la oficina.",
    "Requiere SQL y experiencia con Python o R, análisis de datasets complejos, trabajo reproducible y colaboración con Product, Design, Engineering y Research.",
    "Incluye liderazgo técnico mediante mentoría, mejora de prácticas analíticas y capacidad para llevar proyectos cuantitativos hasta su finalización.",
    "El foco en seller analytics, adopción de producto, onboarding y crecimiento conecta bien con experiencia en analítica avanzada, segmentación, propensión y toma de decisiones basada en datos."
  ],
  "fit_summary": "Oportunidad nueva de alto ajuste por ser un rol Senior de producto en una compañía tecnológica global, híbrido en CDMX y con fuerte componente de SQL, Python/R, analítica de producto, liderazgo e influencia sobre roadmap. Pierde algunos puntos frente a roles fintech o ML-heavy porque no explota directamente banca, fraude, PySpark o GenAI.",
  "identity_key": "a675ea74767544e26e0d6c3b37b4dce000c359073d7aeeea6ff3a70364c557b4",
  "jd_fidelity": "full",
  "jd_fidelity_reasons": [
    "description_chars=5746",
    "substantive_requirements=0",
    "substantive_responsibilities=0",
    "substantive employer-authored JD detail is preserved"
  ],
  "jd_fidelity_score": 60.0,
  "jd_generation_eligible": true,
  "language_confidence": 0.98,
  "language_source": "vacancy_text",
  "location_raw": "Ciudad de México, México",
  "posted_date": "2026-08-29",
  "posted_date_raw": "2026-08-29",
  "provenance": [
    {
      "source_commit": "404df2e8705e1c2b1391ec4375fb887c5a275e2e",
      "source_entry_index": 0,
      "source_format": "vacantes_v1",
      "source_hash": "87feb1e32b097af282998012294e6570866fbdb96b7e9479e22a76ecf901669e",
      "source_native_id": "etsy-1a525f1f-43bc-433b-b37c-b485602533ba",
      "source_path": "Vacantes/enriched/auto/etsy-senior-data-scientist-seller-analytics-e28ceeb72e.json",
      "source_search_date": "2026-08-30",
      "source_updated_at": null
    },
    {
      "source_commit": "404df2e8705e1c2b1391ec4375fb887c5a275e2e",
      "source_entry_index": 0,
      "source_format": "vacantes_v1",
      "source_hash": "4e2185e63f8d3a51167c35efdc78f28f540ec42bdc94ae5151d4f76cc2f63927",
      "source_native_id": "etsy-1a525f1f-43bc-433b-b37c-b485602533ba",
      "source_path": "Vacantes/vacantes_2026-08-30.json",
      "source_search_date": "2026-08-30",
      "source_updated_at": null
    }
  ],
  "requirements": [],
  "responsibilities": [],
  "role_title": "Senior Data Scientist, Seller Analytics",
  "salary": "No especificado",
  "schema_version": 2,
  "seniority": null,
  "tech_stack": [
    "SQL",
    "Python",
    "R",
    "Looker",
    "Product Analytics",
    "E-commerce Analytics",
    "Data Visualization",
    "Quantitative Analysis",
    "Experimentation",
    "Technical Mentoring"
  ],
  "url": "https://careers.etsy.com/jobs/senior-data-scientist-seller-analytics-cdmx-mexico-city-mexico-1a525f1f-43bc-433b-b37c-b485602533ba",
  "vacancy_id": "vac-a675ea74767544e2",
  "work_model": "Hybrid"
}
