{
  "application_language": "en",
  "city": "México / Ciudad de México",
  "company": "Creai",
  "company_category": "Otro",
  "content_hash": "75ce22ba4ed560ff3f2bb7e00575f18f3656f2ca94080016e20f4074552fbd30",
  "description": null,
  "fit_gaps": [
    "Creai presta servicios de IA y consultoría, por lo que se mantiene detrás de empresas puramente de producto según el criterio de priorización.",
    "No presenta un foco específico en banca, fraude o credit scoring."
  ],
  "fit_score": 95.0,
  "fit_strengths": [
    "Rol senior publicado en español y 100% remoto, centrado en diseño, escalamiento y gobierno de sistemas de IA y machine learning.",
    "Exige dominio avanzado de Python, PyTorch, TensorFlow, Scikit-learn y XGBoost, además de experiencia en AWS, GCP o Azure.",
    "Responsabilidad end-to-end desde ingesta y preparación de datos hasta entrenamiento, validación, despliegue, monitoreo y mantenimiento productivo.",
    "Incluye arquitectura de plataformas de ML, definición de estándares técnicos, supervisión de agentes y decisiones sobre riesgos y validación formal."
  ],
  "fit_summary": "Muy alto ajuste técnico y de liderazgo, especialmente por Python, ML productivo, cloud, diseño end-to-end y gobierno de IA; se conserva pese a ser una empresa de servicios porque el puesto pertenece al núcleo técnico de ML/IA.",
  "identity_key": "b968fdbcca798458b3515040c4939273f8cac28665808749a7e4cfb461ffb638",
  "jd_fidelity": "sparse",
  "jd_fidelity_reasons": [
    "description_chars=0",
    "substantive_requirements=0",
    "substantive_responsibilities=0",
    "insufficient original JD detail; source-fit commentary and inferred tech stack do not count toward fidelity"
  ],
  "jd_fidelity_score": 0.0,
  "jd_generation_eligible": false,
  "language_confidence": 0.86,
  "language_source": "role_title",
  "location_raw": "México / Ciudad de México",
  "posted_date": "2026-08-22",
  "posted_date_raw": "2026-08-22",
  "provenance": [
    {
      "source_commit": "0c79dc7286d5eecd32febff80ac8158b1ac14ec6",
      "source_entry_index": 1,
      "source_format": "vacantes_v1",
      "source_hash": "197028ed630aa3655a779d546ee9b09e27c05a4e1e56c3edb82eadf1606f8714",
      "source_native_id": "creai-686991",
      "source_path": "Vacantes/vacantes_2026-08-23.json",
      "source_search_date": "2026-08-23",
      "source_updated_at": null
    }
  ],
  "requirements": [],
  "responsibilities": [],
  "role_title": "Senior Machine Learning Engineer",
  "salary": "No especificado",
  "schema_version": 2,
  "seniority": null,
  "tech_stack": [
    "Python",
    "PyTorch",
    "TensorFlow",
    "Scikit-learn",
    "XGBoost",
    "Machine Learning",
    "Deep Learning",
    "AWS",
    "SageMaker",
    "GCP",
    "Azure ML",
    "MLOps",
    "Model Monitoring",
    "Agentic AI"
  ],
  "url": "https://creai.na.teamtailor.com/jobs/686991-senior-machine-learning-engineer",
  "vacancy_id": "vac-b968fdbcca798458",
  "work_model": "Remote"
}
