{
  "application_language": "en",
  "city": "Mexico City, Mexico",
  "company": "Instructure",
  "company_category": "Producto Tech",
  "content_hash": "93102b4b7085d18cb1fd2a9588ba7987e49f485aa5a71cca2120b976c02e7dbc",
  "description": null,
  "fit_gaps": [
    "Menor conexión directa con banca, fraude y riesgo.",
    "La fuente oficial de postulación no fue visible; el enlace disponible proviene de un agregador con detalle salarial."
  ],
  "fit_score": 91.0,
  "fit_strengths": [
    "Rol senior orientado a decisiones estratégicas, producto, crecimiento e impacto de negocio.",
    "Requiere ownership end-to-end de iniciativas analíticas y trabajo con stakeholders senior.",
    "Fuerte ajuste con experimentación, modelado, storytelling ejecutivo y liderazgo técnico."
  ],
  "fit_summary": "Muy buena opción si se quiere transicionar a Decision Science/Producto con seniority alto y compensación visible.",
  "identity_key": "21cefd168f6539b4051fe2905f903291598dccc81a27e66dae2b6beb36c69a2e",
  "jd_fidelity": "sparse",
  "jd_fidelity_reasons": [
    "description_chars=0",
    "substantive_requirements=0",
    "substantive_responsibilities=0",
    "insufficient original JD detail; source-fit commentary and inferred tech stack do not count toward fidelity"
  ],
  "jd_fidelity_score": 0.0,
  "jd_generation_eligible": false,
  "language_confidence": 0.86,
  "language_source": "role_title",
  "location_raw": "Mexico City, Mexico",
  "posted_date": null,
  "posted_date_raw": "Hace 1-7 días",
  "provenance": [
    {
      "source_commit": "7589efe95ad9fb9e36d848abe835feefd55def92",
      "source_entry_index": 2,
      "source_format": "vacantes_v1",
      "source_hash": "7157cd5af0dff49415219930a853f4a5e620e0b00c9dc748d69190576c7a2d0c",
      "source_native_id": "e2b3da2d04b9",
      "source_path": "Vacantes/vacantes_2026-08-21.json",
      "source_search_date": "2026-08-21",
      "source_updated_at": null
    }
  ],
  "requirements": [],
  "responsibilities": [],
  "role_title": "Senior Decision Scientist",
  "salary": "MEX$911,000 - MEX$1,100,000 por año",
  "schema_version": 2,
  "seniority": null,
  "tech_stack": [
    "Decision Science",
    "Machine Learning",
    "A/B testing",
    "SQL",
    "Product analytics",
    "Stakeholder management"
  ],
  "url": "https://startup.jobs/senior-decision-scientist-instructure-inc-8029739",
  "vacancy_id": "vac-21cefd168f6539b4",
  "work_model": "Remote"
}
