{
  "application_language": "en",
  "city": "Ciudad de México, México",
  "company": "Elsevier",
  "company_category": "Producto Tech",
  "content_hash": "e5be7a4fcfcf81664e6ad63b9dd8522ba8188a63ad66e8d7d6dfee0116d01b8d",
  "description": "<strong>Senior Data Scientist, USA-Philadephila or Mexico-Mexico City.<br><br></strong><em>Are you excited by the opportunity to design advanced AI systems that accelerate scientific discovery and unlock knowledge at scale?<br><br></em><em>Would you enjoy building production-ready solutions using machine learning, NLP, and generative AI to create meaningful impact for researchers and professionals?<br><br></em><strong>About Our Team<br><br></strong>Our global team support products education electronic health records that introduce students to digital charting and prepare them to document care in today’s modern clinical environment. We have a very stable product that we’ve worked to get to and strive to maintain. Our team values trust, respect, collaboration, agility, and quality.<br><br><strong>About The Role<br><br></strong>In this role, you will design and deliver advanced AI, NLP, and generative AI solutions that power knowledge discovery and decision support. You will work with complex scientific data and apply modern machine learning and LLM-based approaches to build scalable, reliable systems with real user impact. You will also collaborate across teams to turn complex challenges into practical, production-ready solutions.<br><br><strong>Responsibilities<br><br></strong><ul><li>Design, build, and evaluate advanced AI/ML, NLP, and generative AI solutions for scientific and knowledge-discovery applications.</li><li>Develop LLM-powered workflows and retrieval-augmented generation (RAG) systems for search, summarization, question answering, and evidence-grounded insight generation.</li><li>Build intelligent retrieval, ranking, recommendation, and decision-support capabilities using modern orchestration frameworks and AI techniques.</li><li>Integrate scientific metadata, ontologies, taxonomies, and knowledge assets into scalable AI workflows.</li><li>Establish robust evaluation, experimentation, and monitoring frameworks to ensure quality, trust, performance, and reliability.</li><li>Write production-ready Python code and partner with engineering teams to deploy solutions at scale.</li><li>Provide technical leadership and mentoring to support high-quality delivery and continuous improvement.<br><br></li></ul><strong>Requirements<br><br></strong><ul><li>Practical experience in data science, AI, machine learning, NLP, information retrieval, or a related quantitative field.</li><li>Strong hands-on experience building AI/ML, NLP, generative AI, and retrieval-based systems in applied or product-focused environments.</li><li>Expertise working with LLMs, including fine-tuning, prompt engineering, grounding strategies, and responsible AI practices.</li><li>Strong Python skills and solid machine learning fundamentals.</li><li>Experience working with large-scale text or content-rich datasets and modern AI/ML frameworks.</li><li>Experience with RAG, semantic, vector, or hybrid search, along with experimentation and evaluation approaches that measure user impact.</li><li>Familiarity with cloud platforms and modern software engineering practices.</li><li>Strong communication, collaboration, and mentoring skills.<br><br></li></ul><strong>Work in a Way That Works for You<br><br></strong>We promote a healthy work/life balance across the organisation. We offer an appealing working prospect for our people. With numerous wellbeing initiatives, shared parental leave, study assistance, and sabbaticals, we will help you meet your immediate responsibilities and your long-term goals.<br><br><strong>Working Pattern<br><br></strong>Working flexible hours - flexing the times when you work in the day to help you fit everything in and work when you are the most productive<br><br><strong>About The Business<br><br></strong>A global leader in information and analytics, we help researchers and healthcare professionals advance science and improve health outcomes for the benefit of society. Building on our publishing heritage, we combine quality information and vast data sets with analytics to support visionary science and research, health education and interactive learning, as well as exceptional healthcare and clinical practice. At Elsevier, your work contributes to the world's grand challenges and a more sustainable future. We harness innovative technologies to support science and healthcare to partner for a better world.<br><br>U.S. National Base Pay Range: $115,400 - $192,300. Geographic differentials may apply in some locations to better reflect local market rates.<br><br><strong>We know your well-being and happiness are key to a long and successful career. We are delighted to offer country specific benefits. Click here to access benefits specific to your location.</strong>",
  "fit_gaps": [
    "La publicación recuperada no confirma modalidad remota o híbrida, por lo que se clasifica conservadoramente como presencial.",
    "SQL y PySpark no aparecen como requisitos explícitos centrales.",
    "El dominio es información científica y salud, no banca, fraude o credit scoring."
  ],
  "fit_score": 96.0,
  "fit_strengths": [
    "Rol orientado a construir sistemas avanzados de AI/ML, NLP y Generative AI con impacto directo en productos de conocimiento y decisión.",
    "Uso intensivo de Python y desarrollo de soluciones productivas con LLMs, RAG, retrieval, ranking, recomendación y decision support.",
    "Responsabilidad explícita sobre evaluación, experimentación y monitoreo de sistemas de IA.",
    "Incluye liderazgo técnico y mentoría, además de colaboración estrecha con ingeniería para desplegar soluciones a escala.",
    "Alineación especialmente fuerte con experiencia reciente en LLMs, IA aplicada y arquitectura end-to-end."
  ],
  "fit_summary": "Oportunidad de altísimo ajuste para un track Senior Applied AI/Data Science: Python, LLMs, RAG, experimentación, producción y liderazgo técnico. Queda debajo de Takeda por no confirmarse modalidad híbrida/remota y por menor alineación de dominio.",
  "identity_key": "f563f704f36a7477d970329272198b8b82dd1819305dfba21677224d45bd2f8a",
  "jd_fidelity": "full",
  "jd_fidelity_reasons": [
    "description_chars=4734",
    "substantive_requirements=1",
    "substantive_responsibilities=0",
    "substantive employer-authored JD detail is preserved"
  ],
  "jd_fidelity_score": 65.0,
  "jd_generation_eligible": true,
  "language_confidence": 0.98,
  "language_source": "vacancy_text",
  "location_raw": "Ciudad de México, México",
  "posted_date": "2026-09-09",
  "posted_date_raw": "2026-09-09",
  "provenance": [
    {
      "source_commit": "a5487baaf46642d861eb55949013f2cfbcc6e244",
      "source_entry_index": 0,
      "source_format": "vacantes_v1",
      "source_hash": "0a3a0f880c488e882dd639a9202ca4941f7ae23c7ac040c302bbd509bfd9a3d8",
      "source_native_id": "elsevier-4464107585",
      "source_path": "Vacantes/enriched/auto/elsevier-senior-data-scientist-i-dc8a629dfe.json",
      "source_search_date": "2026-09-10",
      "source_updated_at": null
    },
    {
      "source_commit": "d2f1d238afd61553bac500c18eed71de4691da65",
      "source_entry_index": 1,
      "source_format": "vacantes_v1",
      "source_hash": "c7303b9a9cd6e411f80c4679d03b48825bc96e05e2893291ae6e358b09cd6633",
      "source_native_id": "elsevier-4464107585",
      "source_path": "Vacantes/vacantes_2026-09-10.json",
      "source_search_date": "2026-09-10",
      "source_updated_at": null
    }
  ],
  "requirements": [
    "{'@type': 'EducationalOccupationalCredential', 'credentialCategory': 'bachelor degree'}"
  ],
  "responsibilities": [],
  "role_title": "Senior Data Scientist I",
  "salary": "No especificado para México",
  "schema_version": 2,
  "seniority": null,
  "tech_stack": [
    "Python",
    "Machine Learning",
    "NLP",
    "Generative AI",
    "LLMs",
    "RAG",
    "Prompt Engineering",
    "Fine-tuning",
    "Information Retrieval",
    "Ranking",
    "Recommendation Systems",
    "Experimentation",
    "Model Evaluation",
    "Model Monitoring",
    "Responsible AI"
  ],
  "url": "https://mx.linkedin.com/jobs/view/senior-data-scientist-i-at-elsevier-4464107585",
  "vacancy_id": "vac-f563f704f36a7477",
  "work_model": "On-site"
}
