{
  "application_language": "en",
  "city": "México (teleworker; viajes ocasionales a Ciudad de México)",
  "company": "Zillow",
  "company_category": "Producto Tech",
  "content_hash": "465b7abeccdf96b97541d14b3dd014fd9866a3daca12f7b3ecd9cd649a6332e1",
  "description": "<strong>About The Team<br><br></strong>The Senior Specialist, Data Science applies advanced analytical methods and machine learning techniques to solve complex business problems, generate actionable insights, and improve Zillow’s products and customer experiences. The role independently drives end‑to‑end data science projects, partnering with cross‑functional teams to define problems, build and evaluate models, and translate findings into scalable, data‑informed decisions.<br><br><strong>About The Role<br><br></strong><ul><li> Lead end‑to‑end data science projects from problem framing and hypothesis design through model development, validation, and deployment, ensuring solutions are aligned with strategic business goals and customer needs. - Develop advanced statistical and machine learning models (for example, prediction, recommendation, or optimization) using large, complex datasets, and rigorously evaluate performance to improve accuracy, fairness, and robustness. - Design and implement efficient data pipelines, feature engineering approaches, and experimentation frameworks in partnership with data engineering and product teams to enable scalable, repeatable analyses and model delivery. - Translate complex quantitative findings into clear, compelling insights and recommendations for technical and non‑technical stakeholders, informing product roadmaps, operational decisions, and measurable business outcomes. - Collaborate closely with product, engineering, analytics, and business partners to identify high‑impact opportunities, define success metrics, and prioritize data science work based on customer value and feasibility. - Establish and advocate for best practices in data quality, model monitoring, documentation, and responsible AI usage, helping to continuously improve the reliability and trustworthiness of data‑driven solutions. - Mentor less experienced team members by sharing domain knowledge, reviewing work, and contributing to a culture of learning, experimentation, and continuous improvement in data science methods and tools. <br><br></li></ul>This role has been categorized as a teleworker position. Teleworkers do not have a permanent corporate office workplace and instead work from a physical location of their choice, which must be identified to the Company. Employees may live anywhere in Mexico, with availability to travel to Mexico City, as we recommend attendance at occasional office events.<br><br>In addition to a competitive base salary and benefits, this position is also eligible for equity awards based on factors such as experience, performance and location.<br><br>Who you are<br><br><ul><li> Bachelor’s degree in Statistics, Mathematics, Computer Science, Engineering, Economics, or a related quantitative field. - 8+ years of professional experience applying statistical analysis, machine learning, or advanced analytics to real‑world business problems in a data‑driven environment. - Demonstrated experience working with large, complex datasets using programming languages such as Python or R and querying languages such as SQL. - Experience designing and evaluating experiments or other causal inference approaches, and using metrics to assess model and product impact. - Experience collaborating in cross‑functional settings (for example, with product, engineering, or operations teams) to deliver and operationalize data science solutions at scale. Or an equivalent combination of education and experience. <br><br></li></ul>Get to know us<br><br>At Zillow, we’re reimagining how people move—through the real estate market and through their careers. As the most-visited real estate platform in the U.S., we help customers navigate buying, selling, financing and renting with greater ease and confidence. Whether you're working in tech, sales, operations, or design, you’ll be part of a company that's reshaping an industry and helping more people make home a reality.<br><br>Zillow is honored to be recognized among the best workplaces in the country. Zillow was named one of FORTUNE 100 Best Companies to Work For® in 2025, and included on the PEOPLE Companies That Care® 2025 list, reflecting our commitment to creating an innovative, inclusive, and engaging culture where employees are empowered to grow.<br><br>No matter where you sit in the organization, your work will help drive innovation, support our customers, and move the industry—and your career—forward, together.<br><br><em>Zillow Group is an equal opportunity employer committed to fostering an inclusive, innovative environment with the best employees. We are committed to equal employment opportunity regardless of race, color, ancestry, religion, sex, national origin, sexual orientation, age, citizenship, marital status, disability, gender identity or Veteran status. If you have a disability or special need that requires accommodation, please contact your recruiter directly.<br><br></em><em>Qualified applicants with arrest or conviction records will be considered for employment in accordance with applicable state and local law.<br><br></em><em>Los Angeles County applicants: Job duties for this position include: work safely and cooperatively with other employees, supervisors, and staff; adhere to standards of excellence despite stressful conditions; communicate effectively and respectfully with employees, supervisors, and staff to ensure exceptional customer service; and follow all federal, state, and local laws and Company policies. Criminal history may have a direct, adverse, and negative relationship with some of the material job duties of this position. These include the duties and responsibilities listed above, as well as the abilities to adhere to company policies, exercise sound judgment, effectively manage stress and work safely and respectfully with others, exhibit trustworthiness and professionalism, and safeguard business operations and the Company’s reputation. Pursuant to the Los Angeles County Fair Chance Ordinance, we will consider for employment qualified applicants with arrest and conviction records.</em>",
  "fit_gaps": [
    "No está enfocado directamente en banca, riesgo, fraude o credit scoring.",
    "PySpark y GenAI no aparecen como requisitos explícitos centrales en la descripción recuperada.",
    "El dominio es PropTech/real estate, por lo que parte de la ventaja sectorial financiera se traslada a habilidades analíticas y de producto."
  ],
  "fit_score": 98.0,
  "fit_strengths": [
    "Posición remota para cualquier ubicación en México, con visitas ocasionales a Ciudad de México.",
    "Requiere 8+ años de experiencia en estadística, machine learning o analítica avanzada, muy cercano al seniority objetivo.",
    "Ownership end-to-end desde problem framing e hipótesis hasta desarrollo, validación, despliegue y monitoreo de modelos.",
    "Pide Python o R, SQL, grandes volúmenes de datos, feature engineering y construcción de pipelines escalables.",
    "Incluye diseño y evaluación de experimentos e inferencia causal para medir impacto de modelos y producto.",
    "Responsabilidad explícita de mentoría, revisión de trabajo y establecimiento de buenas prácticas de Data Science y Responsible AI."
  ],
  "fit_summary": "Es la mejor nueva oportunidad de la corrida por modalidad 100% remota en México, seniority cercano a 9+ años, ownership E2E, experimentación, Python/SQL y liderazgo técnico.",
  "identity_key": "6cb5f8926375e8d194b9b57156fe6e4c2ec7ba74626b7bf391548d4628b4761f",
  "jd_fidelity": "full",
  "jd_fidelity_reasons": [
    "description_chars=6089",
    "substantive_requirements=2",
    "substantive_responsibilities=0",
    "substantive employer-authored JD detail is preserved"
  ],
  "jd_fidelity_score": 70.0,
  "jd_generation_eligible": true,
  "language_confidence": 0.98,
  "language_source": "vacancy_text",
  "location_raw": "México (teleworker; viajes ocasionales a Ciudad de México)",
  "posted_date": "2026-08-27",
  "posted_date_raw": "2026-08-27",
  "provenance": [
    {
      "source_commit": "44b1c57371e276c9ee216b90893c4602722f821a",
      "source_entry_index": 0,
      "source_format": "vacantes_v1",
      "source_hash": "cecc98049ae77de21f083d81e3dfc478aeaba239d64cfb92658c507d76d8c93f",
      "source_native_id": "zillow-4440846424",
      "source_path": "Vacantes/enriched/auto/zillow-sr-data-scientist-cdc3441963.json",
      "source_search_date": "2026-08-29",
      "source_updated_at": null
    },
    {
      "source_commit": "44b1c57371e276c9ee216b90893c4602722f821a",
      "source_entry_index": 0,
      "source_format": "vacantes_v1",
      "source_hash": "8e8b602d6ecc0c28d41911313febe71cf4a3f7f78969c7a52574bb47d4a77a67",
      "source_native_id": "zillow-4440846424",
      "source_path": "Vacantes/vacantes_2026-08-29.json",
      "source_search_date": "2026-08-29",
      "source_updated_at": null
    }
  ],
  "requirements": [
    "{'@type': 'OccupationalExperienceRequirements', 'monthsOfExperience': 96}",
    "{'@type': 'EducationalOccupationalCredential', 'credentialCategory': 'bachelor degree'}"
  ],
  "responsibilities": [],
  "role_title": "Sr. Data Scientist",
  "salary": "No especificado",
  "schema_version": 2,
  "seniority": null,
  "tech_stack": [
    "Python",
    "SQL",
    "Machine Learning",
    "Statistical Modeling",
    "Experimentation",
    "Causal Inference",
    "Feature Engineering",
    "Data Pipelines",
    "Model Deployment",
    "Model Monitoring",
    "Responsible AI",
    "Technical Mentoring"
  ],
  "url": "https://mx.linkedin.com/jobs/view/sr-data-scientist-at-zillow-4440846424",
  "vacancy_id": "vac-6cb5f8926375e8d1",
  "work_model": "Remote"
}
